God names,WtbD(Words to be defined)
,"shawl-šakkukum 𒌆𒊮𒂵𒆕/𒊮𒂵𒆕 šagadu possible logographic meaning, logographically composed of the signs:𒌆tug₂ ""textile, garment, a plow?""-𒊮šag₄ ""heart; inner body, womb, belly, intestines; in, inside, center, interior, middle; weft; content""-𒂵ga ""to carry; to bring, milk; suckling""-𒆕du₃ ""(to be) all, to build, make; to do, perform; to plait?, to go, imperfect singular stem of ŋen⟦to go⟧; to set out; to come, to heap up, pile up, to push, thrust, knock, butt, gore; to combine, multiply geometrically (math.), to spread; to bake; to caulk; to spread out mud to make bricks, strike?"""
,"Utu-Hejal 𒀭𒌓𒃶𒅅 Utuheŋal  possible logographic meaning, logographically composed of the signs:𒀭𒌓d-utu ""the Sun God""-ḫe₂ ""whether""/ gan ""to bear offspring, young; child-bearing""-ŋal₂ ""⟦be⟧ to be (there, at hand, available); to exist; to put, place, lay down; to have; to provide, (compound verb nominal element), to guard, protect, to open"""
,"Tirigan 𒋾𒌷𒂵𒀀𒀭 possible logographic meaning, logographically composed of the signs: ti-ri₂-ga-a-an
"
,"Najsu 𒅘𒋢𒆠 (Naŋsu) possible logographic meaning, logographically composed of the signs: 𒅘nag ""to crush, to drink; to irrigate; to water, sluice""-𒋢su ""flesh; body; entrails (omen), (to be) red, brown, to sink; to submerge; to drain""-𒆠ki "
,"Ili-tappê  𒉌𒉌𒋰𒁀𒂊/𒉌𒉌𒋰𒁀𒂊𒅗  (Ilitappe) possible logographic meaning, logographically composed of the signs:𒉌i₃ ""oil, butter; container for oil""-𒉌li₂ ""oil; fat; cream, to press (oil)""-𒋰tab ""to begin, to burn, fire; to dye (red); to brand, mark, to double; to repeat; to be double strength; to twine; to pair; to block, to flatten, to grasp""-𒁀ba ""to allot; to divide into shares, share, halve; to present; allotment, share, a marine creature?, a garment, a cutting tool; tool for preparing flax""-𒂊e ""barley?, house; temple; estate, household; house-lot; room; container, box; station (of the moon)?; cabin, (a vocative interjection), to leave, go out; to come out, to emerge, to come forward; to remove, take away; to collect; to bring out, send out, pay out; to raise, rear (a child); to sow; to rave; to thread, hang on a string, string beads; to winnow; to measure (grain) roughly (with a stick); to rent; to surpass; to watch over; to calm, princely?, to speak, perfect plural and imperfect stem of dug⟦to speak⟧; to do""-𒅗ka ""(compound verb verbal element), (compound verb nominal element), part of a wagon, rental payment, (unknown meaning), mouth; opening; inlet, mouth (of a canal or river); beginning"""
,"Ur-Ninazu 𒌨𒀭𒎏𒀀𒍪  possible logographic meaning, logographically composed of the signs: 𒌨ur ""dog; lion; figurine, toy, to drag; to go along; to wipe clean, erase; to beat, sweep away; to raise a boat; to flatten; to make baked bricks; to plaster, to spread; to postpone; to hold onto, enemy; hostile, he, one; that, this same; corresponding (to one another); like (one another); thus; together, man, to pluck; to harvest; to gather, collect; gather, female servant,(servant)""-𒀭d/(diŋir) ""deity, god, goddess; personal god""-𒎏nin ""lady; mistress, owner; lord; a quality designation for clothing, sister""-𒀀a ""water; watercourse; semen, sperm; progeny; flood; son""-𒍪zu ""to know, learn; to make known, teach, a building material, tooth; barb; tine; blade; bite; ivory"""
,"Nabi-Enlil 𒈾𒁉𒀭𒂗𒆤/𒁹𒈾𒁉𒀭𒂗𒆤  (Nabienlil) possible logographic meaning, logographically composed of the signs: 𒁹m ""determinative/used before (mainly) masculine personal names,marker for beginning sentences and paragraphs,repetition marker""-𒈾na ""stone; pit; seal; stone weight, pestle; mortar, man, a box""-𒁉bi ""one, he, its, this""-(𒀭d-𒂗en-l𒆤il₂) Enlil (diety)"
,"Karkara 𒅎/𒅎𒆠(logographic spelling most used)/𒋼𒀀𒋼𒀀𒆠(phonectic spelling) (Karkarak/Karkar) possible logographic meaning: not qualified enough to explain the logogram , logographically composed of the signs:"
,"Dabrum 𒁾𒊒𒌝𒆠  possible logographic meaning, logographically composed of the signs: 𒁾dab₄ ""to go around, encircle, turn; to surround; to search; to tarry""/ dub ""to strew; to heap up, pile, pour; to whirl up (a duststorm); pile up, heap, knee, tablet, to tremble, make tremble; to push away, down; to smash, crush, abolish; to flatten""-𒊒 ru ""to remove; to re-position, (compound verb verbal element), an architectural feature""-𒌝um ""a water bird, reed rope""-𒆠ki"
,"Mount Tassa 𒀭𒅎𒋫𒀸𒊭 Iskur/Tarḫun-ta-aš-ša (Tarḫuntašša [Hittite])  possible logographic meaning: Mountain of Tarhun/Mountain of the Storm-God, logographically composed of the signs:"
,"Mount Kanzura/Mount Kandurna/Mount Kandurra 𒅗𒀭𒄙𒈾(𒊏) ka-an-dur-na(ra)/𒃷𒄙𒈾(𒊏)  gán/kán-dur-na(ra)- possibly Mount Tendürek
"
,"galgalturi-instrument (written URUDU-galgalturi  [Hittite])  𒍏𒆗𒆗 𒄙𒊑- [possibly related to: 𒍑𒆪𒌉/𒍑𒆪𒌉𒊏 (galatura [Performer])] possible logographic meaning, logographically composed of the signs:"
,"arkammi-instrument/balag.di harp 𒁆𒁲(balaŋdi)  [Hittite][translation note: balaŋ-di = ṣa-ri-ḫu-um(ṣariḫum)]  possible logographic meaning, logographically composed of the signs:"
,"Duddulla 𒂃𒂃𒉌𒆠(Duduli/Tuttul)/𐎚𐎚𐎍(""Ugaritic"")/Tuttul 𒂃𒂃𒇷𒆠  possible logographic meaning, logographically composed of the signs: (𒂃du₈-𒂃du₈ ""to build, make; to do, perform; to plait?, to go, imperfect singular stem of ŋen⟦to go⟧; to set out; to come, to heap up, pile up, to hold, keep in custody, detain; to restrain, to spread; to bake; to caulk; to spread out mud to make bricks"")-𒂃du₈ ""(to be) full, to heap up, pile up, to hold, keep in custody, detain; to restrain, to spread; to bake; to caulk; to spread out mud to make bricks""- 𒉌li₂ ""to press (oil), (assyr.)oil; fat; cream""-𒆠ki"
,"Byblos 𒁺𒆷 (akk. gubla/  Phoenician 𐤂𐤁𐤋 (gbl), Hebrew גְּבַל (gəḇál), Arabic جُبَيْل (jubayl), Egyptian (kbn), Ugaritic 𐎂𐎁𐎍(gbl)⁠) possible logographic meaning: The Well of God""/""The Origin/Source of God"", logographically composed of the signs:"
,"Mount Hurshana 𒄯𒊭𒈾 Hur-ša-na( A mountain somewhere in  East Pontic Anatolia where the Kaška inhabited/ also possible hittie wordplay for ""secret mountain/(more of a reach)mountain of cursed secrects"" )/ alternatively possibly modern day Mount Harşena possible logographic meaning, logographically composed of the signs:"
,"Purulli Festival  𒁍𒊒𒌌𒇷 (in akk. cuneiform) [Hittite/hatti origin]  bu-ru-ul-li possible logographic meaning: [Hittite](approx.) Earth Festival/[Akk.](corresponds to the Akitu Festival) (approx.)""Festival of the Fruit Harvest"", logographically composed of the signs:

"
,"Kella 𒁹𒆠𒅍𒆷/𒁹𒆠𒀠𒆷 m-ki-il-la  possible logographic meaning, logographically composed of the signs:"
,"Kiskilussa 𒆧𒆠𒇽𒍑𒊭 Kis-ki-lu-us-ša  possible logographic meaning, logographically composed of the signs:"
,marnuwan-beer 𒈥𒉡𒉿𒀭 mar-nu-wa-an
,walhi-drink 𒉿𒀠𒄭 wa-al-hi/𒉿𒀀𒀠𒄭 wa-a-al-hi
,Ziggaratta-possibly Nippur (𒍣𒅅𒂵𒊏 𒀉𒋫 ?)
,Hupasiya 𒄷𒉺𒅆𒅀 hu-pa-si-ia
,Tarukka (𒌷)𒋫𒊒𒊌𒅗 (iri)-ta-ru-ug-ka
,Hattusa (𒌷)𒄩𒀜𒌅𒊭 (iri)-Ha-at-tu-ša
,halenzu-plant 𒄬𒂗𒍪 hal-en-zu
,Liḫzina 𒇷𒍣𒈾 li-zi-na
,Mount Ammuna 𒄠𒈬𒈾 am-mu-na
,"galaktar 𒂵𒌨𒋻(poppy?)  possible logographic meaning, logographically composed of the signs:"
,parhuenas 𒉽𒄷𒂗𒈾 par-hu-en-na (Oats?)
,samama-nuts (written: gis-samama) (𒄑)𒊭𒈠𒈠 ša-ma-ma (hazelut?)
,sahi (𒄑)𒊭𒄭(gis-ša-hi)
,parnulli (𒄑)𒉽𒉡𒇷𒇷 gis-par-nu-li-li
,happuri-yasa 𒄩𒀀 𒀊𒁍𒊑 𒅀𒊭 ha-a-ap-pu-ri-ya-ša
,karas-grains 𒃼𒀸 gar₃-aš (wheat)
,"Urkis/Urkesh/Urkes 𒌨𒄄𒅖𒆠(Urgiš), 𒌨𒆧𒆠(Urkis),𒌨𒋙𒀭𒄲𒆠(Urkes)  possible logographic meaning, logographically composed of the signs:"
,"Ikunta-Luli 𒂊𒆪𒈾𒋫-𒇻𒇷𒅖 (e-ku-na-ta-lu-li-iš)/𒂊𒆪𒈾𒀸𒋫-𒇻𒇷𒅖 (e-ku-na-aš-ta-lu-li-iš) /𒅅𒌦𒋫-𒇻𒇷𒅖 (ig/ik-k/gun-ta-u-li-iš) From 𒂊𒆪𒈾𒀸 (e-ku-na-aš, “cold”[hittite])"
,kuntarra-shrines [hurro-hittite] 𒆪𒈾𒋻𒊏(ku-na-tar-ra)-(𒂍)𒅗𒊑𒅎𒈪((E)-ka-ri-im-mi)/ 𒂍𒆪𒈾𒋻𒊏(ku-na-tar-ra)  kuntarra-karimmi (possibly tabernacle/ tent(ed)-shrine)/ sumer. 𒍝𒇴𒃻 (zalamŋar/ akk. kuštāru)
,Mount Imgarra𒅎𒃼𒊏 im-gar-ra
,
,"Mount Lalapaduwa [Hittite]/Mount Lala (Mount of Lala)[Ugaritic] 𒆷𒆷𒉺𒁺𒉿 possible logographic meaning: (a Mountain where the gods assemble for council), logographically composed of the signs: la-la-pa-du-wa "
,"il-fish 𒅋𒄩  possible logographic meaning, logographically composed of the signs:𒅋IL-𒄩ku₆"
,"Giraba fish 𒄫𒀊𒁀/𒄫𒀊𒁀𒄩 (giraʾabak) possible logographic meaning, logographically composed of the signs: 𒄫gir-𒀊ab-𒁀ba-𒄩ku₆"
,"Gurgal-birds 𒋽𒃲𒄷  possible logographic meaning, logographically composed of the signs:𒋽gur₈-𒃲gal-𒄷 mušen"
,"suda-birds 𒋢𒆳𒊒𒁕(𒄷) (sudda) possible logographic meaning, logographically composed of the signs: 𒋢𒆳𒊒sud₃ unknown meaning-𒁕da-(𒄷) (mušen)"
,kallistarwa-house 𒆗𒇷𒅖𒋻𒉿 kal-li-iš-tar-wa (feast/party?)
,"danna 𒁕𒈾/𒆜𒁍(dana) possible logographic meaning: ""a unit of length, double-hour (distance), double-mile"", logographically composed of the signs: 𒁕da-𒈾na/ 𒆜𒁍danna/𒆜kaskal ""way, road; journey, caravan; military campaign""- 𒁍gid₂/gid ""to drag, tow (a boat upstream); to tighten; to pass along, transfer; to draw up a document; to flay a dead animal; to milk; to unsheath, pull out; to haul (earth), length, (to be) long; to lengthen, extend; to survey, measure out a field; to tighten; to supply; elongated bead or perl; to make (something) enough""/bu ""to howl; to flit, perfect""/sud₄ ""(to be) distant; (to be) remote, long-lasting; to make distant, long (lasting); (to be) profound; (to be) removed""/su₁₃ ""to sprinkle, strew; to adorn, decorate""/bur₁₂""to tear out""/bur ""to spread out, cover; to release, free; to reveal"""
,
,Mt. Nasalma 𒈾𒊭𒀠𒈠 na-ša-al-ma
,"Cimacki 𒇽𒋢/𒇽𒋢𒆠 (Šimaški) possible logographic meaning: ""a designation of sheep and goats/place name"", logographically composed of the signs: 𒇽lu-𒋢kuš/su-𒆠ki (šimaški ki"
,"Ibbi-Suen 𒀭𒄿𒉈𒀭𒂗𒍪 (Ibbisuen)  possible logographic meaning, logographically composed of the signs: 𒀭d-𒄿i-𒉈bi₂-𒀭d-𒂗𒍪suen"
,
,"E-namtila 𒂍𒉆𒋾𒆷  possible logographic meaning: ""house of life""/""house of creation"", logographically composed of the signs: 𒂍 e₂-𒉆nam ""administrative term for absent figure, fate, destiny; determined order; will, testament; (a derivational morpheme used for making nouns from nouns, particularly abstracts); concern, lord""-𒋾til₃ ""(to be) complete, completed; (to be) old, long-lasting; to make complete, end, finish (off), to live (of a single person); to keep alive, sustain; to sit (down); to dwell; to be magnetic, grapevine""-𒆷la"
,"Hursaj-kalama 𒄯𒊕𒌧𒈠/𒄯𒊕𒌧𒈠𒆤 (Hursaŋkalamak)/ 𒄯𒊕𒂵𒇴𒈠 (Hursaŋgalama)possible logographic meaning: ""cella of Enlil on the ziggurat at Nippur/Tell Ingharra (sector of Kish (possibly becoming its own city) where Innana was worshipped with her temple there, as  opposed to Zababba orrshipped in Kish proper""- logographically composed of the signs: ḫur-saŋ-ga-lam-ma"
,
,
,"Kec 𒋙𒀭𒄲𒆠/𒋙𒀭𒄲 (Keš) possible logographic meaning, logographically composed of the signs: 𒋙𒀭𒄲keš₃-𒆠ki/𒋙šuš₂/šu₂ -𒀭an-𒄲HIxGAD/HIxGADA ""unknown meaning"
,"Gu-aba 𒄘𒀊𒁀𒆠/𒄘𒀊𒁀 (Guʾabak)  possible logographic meaning, logographically composed of the signs: 𒄘gu₂-𒀊ab-𒁀ba-𒆠ki"
,"Kinirca 𒆠𒉪𒊭𒆠/𒆠𒉪𒊭 (Kinirša) possible logographic meaning, logographically composed of the signs: 𒆠ki-𒉪nir ""lord; authority; lordly; pure, stretch, to winnow""-𒊭 ša ""(compound verb verbal element), to snap off, the one of-𒆠ki"
,"Nijin 𒀏𒆠/𒀏 niŋin₆ ""the city of Nig̃in or Nina""-ki"
,Sirara 𒌓𒈣𒀏𒆠𒋳 sirara₆/𒌓𒈣𒀏𒋳𒆠	sirara₃-ki
,"Id-nuna-nanna canal  𒀀𒇉𒉣𒈾𒀭𒋀𒆠𒅗 (Idnunananna)  possible logographic meaning: ""The Watercourse of Prince Nanna (Suen)""/[""The (offical) Watercourse of Prince Nanna (Suen)""- note: not a literal translation,but logogram may indicate a special connection to the Moon-God in that he may have personally oversaw the watercouse or created it (first thoughts interpretation could be way off).], logographically composed of the signs:𒀀𒇉id₂-𒉣nun-𒈾na-𒀭d-𒋀𒆠nanna-𒅗ka"
,E-danna (Settlement) 𒂍𒆜𒁍(𒆠)/𒂍𒆜𒁍𒁕𒈾(𒆠) - see danna
,"Gaec (Settlement) 𒂵𒌍𒆠/𒂵𒆜𒆠 (Gaeš)  possible logographic meaning, logographically composed of the signs:ga-eš/ga-eš₈ ""a long distance trader; tax collector, customs collector"""
,"Accu (Settlement) 𒀸𒋗𒆠/𒀸𒋙 (Aššu) possible logographic meaning, logographically composed of the signs: aš-šu/šu₂-ki"
,"E-puhruma (Temple) 𒂍𒁍𒌔𒊒𒌝𒈠 (Epuhruma)  possible logographic meaning, logographically composed of the signs: 𒂍e₂-𒁍pu-𒌔uḫ₂-𒊒ru-𒌝um-𒈠ma"
,"Ki-abrig (Settlement) 𒆠𒉣𒈨𒁺𒆠/𒆠𒀊𒊑𒂵 (Kiʾabrig) possible logographic meaning, logographically composed of the signs:𒆠ki-𒉣𒈨𒁺abrig ""a cultic functionary""-𒆠ki/ki-ab-ri-ga"
,"Ja-bur (Temple) 𒂷𒁓/𒂷𒁓𒊏 (Ŋabura) possible logographic meaning, logographically composed of the signs: 𒂷ŋa₂ ""house; stall""-𒁓bur ""(stone) bowl; (food) offering, sacrifice; meal(-time); pond, a garment, to spread out, cover; to release, free; to reveal, to tear out, a unit of area; a unit of volume""-𒊏ra"
,"E-gida (Temple) 𒂍𒁍𒁕 (Egida) possible logographic meaning, logographically composed of the signs: 𒂍e₂-𒁍gid₂-𒁕da"
,"E-nutura (Temple) 𒂍𒉡𒌉𒊏 possible logographic meaning, logographically composed of the signs:𒂍e₂-𒉡nu-𒌉tur-𒊏ra"
,"Jicbanda (Temple/Settlement/Divine Name) 𒄑𒌉𒁕/𒄑𒌉𒁕𒆠 (Ŋešbanda) possible logographic meaning, logographically composed of the signs: 𒄑ŋeš-𒌉banda₃-𒁕da"
,"Kuara (Settlement) 𒀀𒄩𒆠/𒄩𒀀(𒆠)(Kuʾara) possible logographic meaning, logographically composed of the signs:	𒀀𒄩kuara₂/𒄩𒀀kuara "
,"[shullat and hanish?]Ka-hejala 𒀭𒅗𒃶𒅅(Kaheŋala) and Igi-hejala,𒀭𒅆𒃶𒅅(Igiheŋala) (Divine Name) possible logographic meaning, logographically composed of the signs:𒅗 ka ""(compound verb verbal element), (an official?), part of a wagon, (unknown meaning), part of a wagon""mouth; opening; inlet, mouth (of a canal or river); beginning""- 𒅆 igi ""eye; carved eye (for statues); hub (of a wheel); mesh, a mathematical term (math.), reciprocal, face; front; first, earlier; reciprocal; hyena?""-𒃶𒅅 ḫe₂-ŋal₂ ""plenty""( lit. “let there be”)/ 𒃶 ḫe₂ ""whether""/gan ""to bear offspring, young; child-bearing""-𒅅 ""⟦be⟧ to be (there, at hand, available); to exist; to put, place, lay down; to have; to provide, (compound verb nominal element), to open, (neo.assyr.) to guard, protect"""
,
,"bursaj building 𒁓𒊕 (Building/Offering/Servant)possible logographic meaning: (a type of storehouse?), logographically composed of the signs: 𒁓bur  ""(stone) bowl; (food) offering, sacrifice; meal(-time); pond, a garment, priest, to spread out, cover; to release, free; to reveal, to tear out, a unit of area; a unit of volume""-𒊕saŋ ""head; top; top quality; capital; person, people; slave; corpse; short side (of a field); side (math.); front; bulb (of alliums); first; first part, beginning; principal; people; former, to choose; choice"""
,"unuribanda (locus)𒋼𒀕𒊑𒌉(𒁕)(unu₂.RI.banda₃) logographic meaning: ""a sacred area"", logographically composed of the signs:𒋼𒀕unu₂ "" alternative of unu/unug ""banquet; dining room; the most sacred part of a temple; seat, throne; dwelling, domicile, abode"", adornment, jewelry; jewelry box, upper cheek; mouth4, girl, young woman, meal, food; meal(-time); table, (wooden) stick""-𒊑RI ""(unknown meaning), to lay down, cast, place; to set in place, imbue; to lean on; to impose; to throw down; to release, let go; to walk along; to pour out; to lead away; to ride; to walk along, (to be) distant, to cry out""-𒌉banda₃ ""(to be) junior; child; (to be) wild, fierce, quotient, sagacity, stanchion, support""-𒁕da/banda₃-da""(to be) junior; child; (to be) wild, fierce, quotient, sagacity, stanchion, support"""
,"Gayau (Divine Name) 𒀭𒂵𒀀𒀀𒌑/𒀭𒂵𒀀𒌑 (Gayayu) possible logographic meaning, logographically composed of the signs: d-ga-a ""water; watercourse; semen, sperm; progeny; flood; son, arm; plow handle; side; wing; horn; strength; power; wage, wages; rent; strap; part of a scale; weapon; work, a cry of woe; to cry, groan""-a-u₂ ""and; but; also, bed, (compound verb nominal element), defeat, emery, sheep, ewe, grass, herb; bread, loaf; food; pasture; plant(s); grass-fed, horn, load, oil, peace, pitfall, to ride; an attachment to a plow or harrow; upper pivot of a door; ship's cabin; to gain control; to sail a ship; to alloy (of metals)?; (to be) high; (to be) great, sleep, ""/d-ga-aya₂ ""a cry of woe; to cry, groan, father""-u₂/ a-a/aya ""water; watercourse; semen, sperm; progeny; flood; son, a cry of woe; to cry, groan, father"""
,"Cuni-dug (Divine Name) 𒀭𒋗𒉌𒄭/𒀭𒋗𒉌𒌌(Šunidug) possible logographic meaning, logographically composed of the signs:  𒀭d-𒋗šu-𒉌ni-𒄭dug₃/𒀭d-𒋗šu-𒉌ni-𒌌du₇"
,"Dubla-mah (Temple) 𒁾𒇲𒈤 (Dublamah) possible logographic meaning, logographically composed of the signs:𒁾dub ""to strew; to heap up, pile, pour; to whirl up (a duststorm); pile up, heap, knee, tablet, to tremble, make tremble; to push away, down; to smash, crush, abolish; to flatten, chest; coffin""-𒇲la₂-𒈤 maḫ ""(to be) great; to make great, (to be) mature, milk producing (of cows)"""
,"usga-priests 𒊻𒂵(uzga [priest]/or  (𒍖𒂵ušga [youth]) possible logographic meaning: ""a priest; goods, treasure"", logographically composed of the signs: 	uz-ga"
,"E-temen-ni-guru (Temple) 𒂍𒋼𒉎𒅍/𒂍𒋼𒉎𒅍𒊒(Etemenniguru) possible logographic meaning, logographically composed of the signs: 	e₂-temen-ni₂-guru₃/gur₃-ru"
,"Upsukkinaku (Temple/Assembly) (Ubšuʾunkenak/ubšuʾunkinak) 𒌒𒋗𒌺𒈾/𒌒𒋗𒌺𒈾𒅗/𒌒𒋗𒆥𒈾𒅗 ŠU<(ubšukkinnakku)>ku₁₃ logographic meaning: ""Court of Assembly"", logographically composed of the signs: 𒌒ub ""corner, recess; part of a door, to enunciate""/ar₂ ""hymn of) praise; fame; to celebrate, praise, ruin""-𒋗šu ""hand; talon, claw; paw; favor; a cloth; strength; bunch, pestle, pounder, muller; a stone or shell""-𒌺unken/unkin ""assembly""-𒈾na-𒅗ka/𒌒ub-𒋗šu-𒆥kin ""sickle""/kiŋ₂ ""work; to work (something); message, (to be) pointed, to seek, search""-𒈾na-𒅗ka
"
,"Gruesome-Battle and Strife possible logographic meaning, logographically composed of the signs: Need to find a proper transliteration"
,"Overthrows-All-Formations possible logographic meaning, logographically composed of the signs: Need to find a proper transliteration"
,"E-sara/Esharra 𒂍𒊬/𒂍𒊹𒊏/𒂍𒊬𒊏 (Ešara) logographic meaning  ""House of the Universe"", logographically composed of the signs: 𒂍e₂-𒊬šar ""to make splendid""/𒂍e₂-𒊹šar₂ ""to slaughter,(to be) perfect?, to mix; (to be) mixed, 3600; totality, world; a unit of area; (to be) numerous; to make numerous, a designation of cloth""-𒊏ra"
,"Nibiru 𒀭𒉌𒁉𒊒/𒀭𒉈𒁉𒊒 (Neberu) possible logographic meaning, logographically composed of the signs: d-ne₂/ne-be₂-ru"
,"Arahtu canal 𒀀𒇉𒀀𒊏𒄴𒌈 possible logographic meaning, logographically composed of the signs:𒀀𒇉 id₂-𒀀a-𒊏ra-𒄴aḫ/eḫ ""saliva, spittle; phlegm, mucus, sputum; a paste; foam, scum; poison; copper slag""/ eḫ""insect(s), bug(s); moth, louse, flea; head-louse; to have lice""-𒌈tum ""(to be) suitable, appropriate; (to make) suitable, appropriate, to bring; to take, cross-beam"""
,"Cuthah 𒄘𒂃𒀀𒆠/𒄘𒂃𒀀 (Gudua) possible logographic meaning, logographically composed of the signs: 	 𒄘gu₂-𒂃du₈-𒀀a-𒆠ki"
,"Borsippa 𒂦𒋛𒀊𒁀𒆠/𒂦𒋛𒀊𒁀 (Badsiabba) possible logographic meaning, logographically composed of the signs:𒂦bad₃ ""wall, fortification""-𒋛si-𒀊ab ""cow, sea, window, window opening; roof vent; specification of a mash-tub""-𒁀ba""to allot; to divide into shares, share, halve; to present; allotment, share, a marine creature?, a garment""/(bad) ""to open, undo; (to be) remote; to thresh grain with a threshing sledge; to close, wall, fortification, half; thirty, a cutting tool; tool for preparing flax""/𒀊𒁀ab-ba ""father; old (person); elder; an official, witness""-𒆠ki"
,"Akitu-house  𒀉𒆠𒋾(akiti [feastival/month name) logographic meaning: a festival at new year; month name"", logographically composed of the signs:𒀉a₂-𒆠ki-𒋾ti"
,"Esiskur (Temple name) 𒂍𒀬𒀬/𒂍𒀬 logographic meaning: ""House of prayer"", logographically composed of the signs: 𒀬𒀬siškur₂/siškur𒀬  ""prayer, blessing; offering, sacrifice, rites; to pour (a libation), offer a sacrifice; to intercede"""
,"Bit-Karkara 𒅎𒆠/ 𒅗𒅎𒆠(Karkarak) possible logographic meaning, logographically composed of the signs: 𒅗ka-𒅎karkar-𒆠ki"
,"Namzidtara 𒉆𒍣𒋻/𒉆𒍣𒋻𒊏 possible logographic meaning, logographically composed of the signs: 𒉆nam ""administrative term for absent figure, fate, destiny; determined order; will, testament; (a derivational morpheme used for making nouns from nouns, particularly abstracts); concern, lord""-𒍣zid ""to chirp (birds), to cut, remove; to erase; to pluck; tear out?; to blink, life; throat; breath""-𒋻tar ""to cut; to cut down; to untie, loosen; to scatter, disperse; to decide, decree; to cut, tear apart, a disease, (compound verb verbal element), a disease, a garment""-𒊏 ra"
,"E-halanki 𒂍𒄬𒀭𒆠[alt?: 𒄬𒀭𒆬 (Halankug)] logographic meaning: ""House of the secrets of heaven and the netherworld"", logographically composed of the signs:        
𒂍é-𒄬ḫal  ""to divide, deal out, distribute; to perform an extispicy; to open; a secret; to pour away; to sieve; to slink, crawl away; a qualification of grain, a basket, a basket,to roll (around), upper thigh, a stick, metal part of the donkey harness""/hala ""inheritance share, lot; to divide up""-𒀭an-𒆠ki"
,"E-temen-anki 𒂍𒋼𒈨𒀭𒆠/𒂍𒋼𒈨𒂗𒀭𒆠(Etemenanki)[ziggurat of Marduk at Babylon] possible logographic meaning: ""House Suitable for the Lord of Heaven and Earth"", logographically composed of the signs:𒂍e₂-𒋼te ""cheek""-𒈨me ""Being, divine properties enabling cosmic activity, rites; (cultic) ordinance; office; prayer, battle; combat, to be, desire; sexual power, virility, to wash, refine, silence, stiffness""/ 𒈨𒋼/𒋼𒈨mete ""appropriate thing, ornament, image, one's own, self"" -𒂗en ""lord; master; ruler, a priest, priestess""-𒀭an-𒆠ki"
,"elmesu-stone[akk.]  𒋤𒁺𒉘/𒋤𒉘/ 𒋢𒁕𒉘(sudaŋ)/(sud.aga)  logographic meaning: ""a precious metal or material (possibly amber); (to be) shiny"", logographically composed of the signs: 𒋤sud-𒁺ra₂-𒉘aŋ₂/𒋢su-𒁕da-𒉘aŋ₂"
,"zaginduru-stone 𒍝𒆳𒌅/𒎎𒍝𒆳𒀀) logographic meaning: ""Lapis"", logographically composed of the signs: 𒍝za-𒆳gin₃ ""mountain(s)""-𒌅tur₅  ""(young) child, (to be) ill, sick; illness, disease, (to be) small; (to be) young; (to be) narrow; to reduce, diminish; to subtract; to deduct; to shred""/𒎎na₄-𒍝za-𒆳gin₃-𒀀duru₅ ""(to be) soft; (to be) wet, irrigated, damp, moist; (to be) fresh"""
,"taklimu-offerings [Sumerian] 𒉘𒉻𒀭𒈹/𒉘𒁕𒁀 (aŋdaba [old-babylonian/neo-assyr.])  logographic meaning: ""bread offering"", logographically composed of the signs: aŋ₂-nidba/aŋ₂-da-ba"
,"E-meslam 𒂍𒈩𒇴(𒈠)/𒂍𒈨𒀊𒇴 possible logographic meaning, logographically composed of the signs: 𒂍e₂-𒈩mes ""blackness, black spot; black wood, hero; young man; (to be) manly, a tree, hackberry""-𒇴lam""(compound noun nominal element),cutting, to flourish; to make grow luxuriantly, nut-bearing tree, almond; sapling""-𒈠ma/𒂍e₂-𒈨me ""Being, divine properties enabling cosmic activity, rites; (cultic) ordinance; office; prayer"", battle; combat, to be, desire; sexual power, virility, heaven, stiffness, we""-𒀊eš₃ ""shrine; an establishment,three; triplets""-𒇴lam"
,"kidinnu(akk) 𒂬 (ubara [PROTECTION])(OB) logographic meaning: ""divine protection"", logographically composed of the signs: EZEN X KASKAL [""festival"" X ""way, road; journey, caravan; military campaign""]"
,
,"Imgur-Ellil 𒅎𒄥𒀭𒂗𒆤 (Imgur-Enlil)  possible logographic meaning: ""inner city wall of Babylon"", logographically composed of the signs:  𒅎 im-𒄥gur/((𒅎𒄥 Imgur- ""envelope"")-d-en-lil₂"
